{
  "$schema": "../../schemas/agent.schema.json",
  "id": "jarvis-openai",
  "supabase_id": "a2222222-2222-4222-8222-222222222222",
  "name": "Jarvis Executor",
  "provider": "openai",
  "model": "gpt-4.1",
  "role": "executor",
  "status": "active",
  "description": "Fast execution agent for structured tasks, API calls, and tool use",
  "capabilities": ["tool_use", "structured_output", "code"],
  "tools": ["notion", "github", "supabase"],
  "system_prompt_ref": "prompts/executor.md",
  "config": {
    "max_tokens": 4096,
    "temperature": 0.2
  }
}
